{
  "schema_version": "logic_ir_v1",
  "diagram_type": "logic",
  "style": "iec",
  "title": "nor_latch",
  "inputs": [
    "VI1",
    "VI2"
  ],
  "gates": {
    "G1": {
      "type": "NOR",
      "inputs": [
        "VI1",
        "G2"
      ]
    },
    "G2": {
      "type": "NOR",
      "inputs": [
        "VI2",
        "G1"
      ]
    }
  },
  "outputs": {
    "VO1": "G1",
    "VO2": "G2"
  },
  "notes": "交叉耦合 NOR；版式镜像"
}