{
  "schema_version": "logic_ir_v1",
  "diagram_type": "logic",
  "style": "iec",
  "title": "ex_6_2_1_jk",
  "inputs": [
    "CLK"
  ],
  "gates": {
    "FB": {
      "type": "NAND",
      "inputs": [
        "FF2",
        "FF3"
      ]
    },
    "FF1": {
      "type": "JKFF",
      "inputs": [
        "FB",
        "CLK",
        "ONE"
      ]
    },
    "nQ1": {
      "type": "NOT",
      "inputs": [
        "FF1"
      ]
    },
    "nQ3": {
      "type": "NOT",
      "inputs": [
        "FF3"
      ]
    },
    "K2": {
      "type": "NAND",
      "inputs": [
        "nQ1",
        "nQ3"
      ]
    },
    "FF2": {
      "type": "JKFF",
      "inputs": [
        "FF1",
        "CLK",
        "K2"
      ]
    },
    "J3": {
      "type": "AND",
      "inputs": [
        "FF1",
        "FF2"
      ]
    },
    "FF3": {
      "type": "JKFF",
      "inputs": [
        "J3",
        "CLK",
        "FF2"
      ]
    },
    "Y": {
      "type": "NOT",
      "inputs": [
        "FB"
      ]
    }
  },
  "outputs": {
    "Y": "Y",
    "Q1": "FF1",
    "Q2": "FF2",
    "Q3": "FF3"
  },
  "notes": "式(6.2.1)：J1=(Q2Q3)' K1=1；J2=Q1 K2=(Q1'Q3')'；J3=Q1Q2 K3=Q2；Y=Q2Q3"
}